{
  "schema_version": 1,
  "dataset_id": "cemig-projetos-reais-privados",
  "dataset_version": "2026.07-draft.1",
  "status": "EM_PREPARACAO",
  "created_at": "2026-07-21T00:00:00-03:00",
  "frozen_at": null,
  "access_policy": "POLITICA-ACESSO.md",
  "sensitive_source_files": true,
  "pdf_count": 9,
  "samples": [
    {
      "id": "amostra-001",
      "sha256": "6f39d37fb763a032dca16f12b7a9a5f4693959c91abb8894a0c4e422b32c6a31",
      "bytes": 1666904,
      "pages": 1,
      "split": "DESENVOLVIMENTO",
      "scale": "1:1000",
      "format": "A3",
      "orientation": "RETRATO",
      "quality": "NATIVO",
      "density": "MEDIA",
      "double_annotation": false,
      "page_points": [841.89, 1190.55],
      "text_characters": 1345,
      "top_level_images": 11,
      "annotations": {"Stamp": 1, "Popup": 1},
      "producer_family": "iText"
    },
    {
      "id": "amostra-002",
      "sha256": "b76745968ee6f54e3a56badd483571f2f7d54c48de2a83f00af146bd18967761",
      "bytes": 2555073,
      "pages": 1,
      "split": "DESENVOLVIMENTO",
      "scale": "1:1000",
      "format": "A4",
      "orientation": "RETRATO",
      "quality": "NATIVO",
      "density": "ALTA",
      "double_annotation": false,
      "page_points": [595.32, 841.92],
      "text_characters": 346,
      "top_level_images": 2,
      "annotations": {"Stamp": 7, "Popup": 7, "FreeText": 3},
      "producer_family": "Microsoft Print to PDF"
    },
    {
      "id": "amostra-003",
      "sha256": "2190a9d76b4a017d61ce78f913211963d6bf6d62f95b8a62d2702335032325d1",
      "bytes": 7839068,
      "pages": 1,
      "split": "TESTE",
      "scale": "1:1000",
      "format": "A4",
      "orientation": "RETRATO",
      "quality": "HIBRIDO",
      "density": "BAIXA",
      "double_annotation": false,
      "page_points": [595.28, 841.89],
      "text_characters": 992,
      "top_level_images": 40,
      "annotations": {"Stamp": 9, "Popup": 9},
      "producer_family": "iText"
    },
    {
      "id": "amostra-004",
      "sha256": "1ed6b40194b729f317e0c6f546ae4d5152eaa919166f6c5e3ad6692bd3ce457a",
      "bytes": 552857,
      "pages": 1,
      "split": "DESENVOLVIMENTO",
      "scale": "1:1000",
      "format": "A3",
      "orientation": "PAISAGEM",
      "quality": "NATIVO",
      "density": "BAIXA",
      "double_annotation": false,
      "page_points": [1191.0, 842.0],
      "text_characters": 2002,
      "top_level_images": 3,
      "annotations": {"Square": 9, "Stamp": 2, "Popup": 2},
      "optional_content_groups": 8,
      "producer_family": "AutoCAD"
    },
    {
      "id": "amostra-005",
      "sha256": "336f830ac491403ffc6f8c92715d043dd749c3d5d9dfe944613dd38fcf2452b6",
      "bytes": 2062642,
      "pages": 1,
      "split": "DESENVOLVIMENTO",
      "scale": "1:1000",
      "format": "A4",
      "orientation": "PAISAGEM",
      "quality": "NATIVO",
      "density": "MEDIA",
      "double_annotation": false,
      "page_points": [841.89, 595.28],
      "text_characters": 1486,
      "top_level_images": 1,
      "annotations": {"Stamp": 8, "Popup": 8},
      "expected_spans": {
        "INSTALAR": [30, 30, 50, 55],
        "REMOVER": [105]
      },
      "producer_family": "iText"
    },
    {
      "id": "amostra-006",
      "sha256": "12c60c4192b3f41ec32a43ddd12e861a342f213c42b8df84644c5d0e334a336c",
      "bytes": 136995,
      "pages": 1,
      "split": "TESTE",
      "scale": "1:1000",
      "format": "A4",
      "orientation": "RETRATO",
      "quality": "NATIVO",
      "density": "ALTA",
      "double_annotation": true,
      "page_points": [595.28, 841.89],
      "text_characters": 2045,
      "top_level_images": 5,
      "annotations": {"FreeText": 7},
      "known_edge_cases": ["malformed-annotation-text-encoding"],
      "producer_family": "iText"
    },
    {
      "id": "amostra-007",
      "sha256": "b1ff5a9c3e60fbbcbe627a2117ff744f7bb5102e077bf1ba2b01f38c6f44cd89",
      "bytes": 5993612,
      "pages": 1,
      "split": "TESTE",
      "scale": "1:1000",
      "format": "A3",
      "orientation": "RETRATO",
      "quality": "NATIVO",
      "density": "ALTA",
      "double_annotation": true,
      "page_points": [841.89, 1190.55],
      "text_characters": 1860,
      "top_level_images": 0,
      "annotations": {"Stamp": 10, "Popup": 10},
      "known_edge_cases": ["visible-images-in-annotation-appearance-streams"],
      "producer_family": "iText"
    },
    {
      "id": "amostra-008",
      "sha256": "06527203599112d8a606da66ef1be71d02eff6decd22786d25d04f082d277c3e",
      "bytes": 1472782,
      "pages": 1,
      "split": "DESENVOLVIMENTO",
      "scale": "1:1000",
      "format": "A3",
      "orientation": "RETRATO",
      "quality": "NATIVO",
      "density": "BAIXA",
      "double_annotation": false,
      "page_points": [841.89, 1190.55],
      "text_characters": 1292,
      "top_level_images": 9,
      "annotations": {"Stamp": 1, "Popup": 1},
      "producer_family": "iText"
    },
    {
      "id": "amostra-009",
      "sha256": "8c24384fa5b8981de36949009da508cfe548a932a151b515bdb134a478e2b4a4",
      "bytes": 3239558,
      "pages": 1,
      "split": "TESTE",
      "scale": "1:1000",
      "format": "A4",
      "orientation": "RETRATO",
      "quality": "NATIVO",
      "density": "MEDIA",
      "double_annotation": false,
      "page_points": [595.28, 841.89],
      "text_characters": 1306,
      "top_level_images": 11,
      "annotations": {"Stamp": 1, "Popup": 1},
      "producer_family": "iText"
    }
  ]
}
